{
  "$schema": "https://json-schema.org/draft/2020-12/schema",
  "title": "songs.json",
  "type": "array",
  "items": {
    "type": "object",
    "properties": {
      "english_title": {
        "type": "string"
      },
      "arabic_title": {
        "type": [
          "string",
          "null"
        ]
      },
      "themes": {
        "type": "array",
        "items": {
          "type": "string"
        }
      },
      "tbodies": {
        "type": "array",
        "items": {
          "type": "object",
          "properties": {
            "rows": {
              "type": "array",
              "items": {
                "type": "object",
                "properties": {
                  "row-class": {
                    "type": "string"
                  },
                  "cells": {
                    "type": "array",
                    "items": {
                      "type": "object",
                      "properties": {
                        "english": {
                          "type": "string"
                        },
                        "enPhonicsSongs": {
                          "type": "string"
                        },
                        "arabic": {
                          "type": "string"
                        },
                        "enPhonics1": {
                          "type": "string"
                        }
                      },
                      "required": [],
                      "additionalProperties": true
                    }
                  }
                },
                "required": [
                  "cells",
                  "row-class"
                ],
                "additionalProperties": true
              }
            }
          },
          "required": [
            "rows"
          ],
          "additionalProperties": true
        }
      },
      "audio_file": {
        "type": "string"
      },
      "coptic_title": {
        "type": [
          "string",
          "null"
        ]
      }
    },
    "required": [
      "english_title",
      "tbodies",
      "themes"
    ],
    "additionalProperties": true
  }
}
